input_text,answer
where's the pro bowl going to be this year,Camping World Stadium in Orlando
who sang the song a white sports coat and a pink carnation,Marty Robbins
who sings the pokemon theme song season 1,Jason Paige
who proclaimed 5th october as world’s teachers day,UNESCO/ILO
who plays reggie the robot in justin's house,Ben Faulks
where was the hindenburg scheduled to fly and how many passengers were on it,36 passengers
who created the pieta and also painted the ceiling of the sistine chapel,Michelangelo
who sings far from the home i love in fiddler on the roof,Hodel
what is the largest city in the united states per square mile,Sitka
who was the mexican commander who surrendered to the texans at the capturing of san antonio,Sanchez Navarro
when is the running of the bulls held in spain,6–14 July
who sang how long has this been going on song,Ace
what was the lowest barometric pressure for hurricane irma,914 mbar (hPa)
when did david akers kick the 63 yard field goal,"September 9, 2012"
who plays the scary nun in the conjuring 2,Bonnie Aarons
season 2 attack on titan how many episodes,12
when did korn's follow the leader come out,"August 18, 1998"
when did the battle of badr take place,13 March 624
how many gallons of water in the gulf of mexico,660 quadrillion US gallons
fast and furious 7 red car abu dhabi,The Lykan Hypersport
when did canada gain independence from great britain,"April 17, 1982"
who unveiled the new coat of arms on 27 april 2000,South Africa
when was 13 reasons why released on netflix,"March 31, 2017"
who plays the principal in santa clarita diet,Thomas Lennon
where is the country music hall of fame located,"Nashville, Tennessee"
how long are the episodes in stranger things season 1,42–62 minutes
what is the number of basic units in the international system of units,seven
who was elected senator of illinois in 1858,Stephen A. Douglas
what is the number of cities in texas,961
who was the 19th c. artist who was both painter and graphic designer,René Georges Hermann-Paul
when was the nobel prize for literature first awarded,1901
who plays the voice of the hormone monster,Nick Kroll
where do most star formation occur in the milky way today,molecular clouds in interstellar space
where does saying bob's your uncle come from,unknown origin
where does the highway of heroes start and end,Glen Miller Road in Trenton
who played tibbs on in the heat of the night,Howard Ellsworth Rollins Jr.
where did the name huey helicopter come from,originally designated HU-1
when were the beatles inducted into the rock and roll hall of fame,1988
what color is the cue ball in pool,white
when does april fools day end at noon,April 1st
what is the rank of pakistan in population,5
who grows the most coffee in the world,Brazil
who plays peter in what we do in the shadows,Ben Fransham
who plays connor's mom in madeas christmas,Kathy Najimy
how long prime minister stay in office canada,four years
what is the movie about six degrees of separation,Six Degrees of Separation
who wrote the text for jeanie with the light brown hair,Stephen Foster
who got the most rings in the nba,Bill Russell
who is the girl in the stone sour video say you'll haunt me,Joanna Moskawa
who did the steelers lose to in the playoffs last year,New England Patriots
who is known as the philippine queen of bossa nova,Sitti Navarro
when's the last time philly won the superbowl,2017
who played ben stone son on law and order,Michael Moriarty
when was the last time university of michigan won a national championship,1997
who sang nice day for a white wedding,Billy Idol
what does g stand for in ncis los angeles,Grisha
who wrote the first declaration of human rights,Cyrus
jharkhand which festival is associated with cattle worship,Sohrai
who was charlie writing to in perks of being a wallflower movie,an unknown recipient
who sings will you still love me when i'm not young and beautiful,Lana Del Rey
where are more than half your bones located,the appendicular skeleton
what does aa on a license plate mean,cars of the royal family
who does the voice of little chef in ratatouille,Ian Holm
in the song i drive your truck who is he talking about,his brother
at what age are you no longer a toddler,36 months
whats the movie called with justin timberlake and time,In Time
a concave mirror can form a real image which is a copy of an object that forms,inverted
when did the first battle of ypres end,22 November 1914
who were farmers who kept a small portion of their crops & gave the rest to the landowners,Sharecropping
who sings you can't get what you want,the Rolling Stones
who plays the beast on the new beauty and the beast,Dan Stevens
who gets the most punishments on impractical jokers,Sal
what is the name of governor of maharashtra,Chennamaneni Vidyasagar Rao
what is the lead singers name of staind,Aaron Lewis
who plays nathan's mother on general hospital,Donna Mills
who supported states rights during the civil war,the Confederacy
who is the actor that plays sneaky pete,Giovanni Ribisi
who sang i want to be bobbys girl,Marcie Blane
where was 2017 beauty and the beast filmed,"Surrey, United Kingdom"
where is dakar located on the world map,Senegal
the duluth model is an intervention program that emphasizes,re-education
where are the first nations located in canada,south of the Arctic
where does puerto rico's power come from,Puerto Rico Electric Power Authority
a synonym for the content component of communication is,information
when was the first ford f 150 made,1975
who votes in the speaker of the house,The House of Representatives
who plays young agent o in mib 3,Alice Eve
when does boomer find out she a cylon,Kobol's Last Gleaming
what's the largest city park in the united states,Franklin Mountains State Park
how many levels of protein structure are there,four
when did university stop being free in australia,1989
panic at the disco song about a wedding,I Write Sins Not Tragedies
how many pages are in the book inside out and back again,263
who plays the dwarf king in the hobbit,Richard Crispin Armitage
when do you declare honors in contract bridge,any time after the auction
what is the name of manchester united stadium,Old Trafford
what is the account number of airtel payment bank,Your Airtel mobile number
what type of boundary was the mexico earthquake,a subduction zone
how long is one full rotation of the earth,about 24 hours
where did the world's largest recorded wave occur,Lituya Bay in Alaska
where does half life 2 episode 2 take place,outside City 17
sequel to a christmas story it runs in the family,My Summer Story
who played bailey in the sisterhood of the traveling pants,Jenna Boyd
when does season 18 of law and order svu start,"September 21, 2016"
where does the term jack mormon come from,"Jackson County, Missouri"
what is the coldest it has ever been in antarctica,−128.6 °F
who is the president of the republic of zambia,Edgar Lungu
in another world with my smartphone japanese title,異世界はスマートフォンとともに
who designed the earth day flag in 1969,John McConnell
when was the last time villanova won the ncaa basketball championship,2018
what is the biggest determinant of climate in venezuela,altitude
the king of kalinga in the mauryan period was,Ashoka
who is the no. 1 ranked tennis player in the world,Rafael Nadal
who does the voice of cruz on cars 3,Cristela Alonzo
who were the the continent of the americas named after logically,Amerigo Vespucci
who is the guy that jumped from space,Felix Baumgartner
when is the next step season 3 coming out,"March 16, 2015"
when did the wall go up in east germany,"), starting on"
who is the longest serving manager in manchester united history,Sir Alex Ferguson
what is bermuda competing in the winter olympics,Cross-country skiing
fictional character whose favorite song was blueberry hill,Richie Cunningham
where is cinque terre italy on a map,"Liguria, Italy"
what is the average height of a chinese man,5 ft 6 in
what is the big gold dome in jerusalem,Dome of the Rock
which philosopher advocated the idea of return to nature,Bacon
what is the genus of a bald eagle,Haliaeetus
who won oscar for best director this month,Guillermo del Toro
who sings love will keep us alive by the eagles,Timothy B. Schmit
where is the university of wisconsin madison located,"Madison, Wisconsin"
a town in west yorkshire on the river aire home to a rugby league team,Castleford
how many seasons of the glades were made,four
who played the mom in the partridge family,Shirley Mae Jones
where are the highest average incomes found in north america,Virginia
what hangs from the trees in the bayou,Spanish moss
where is the food stored in a yam plant,an edible tuber
whens the last time the patriots played the eagles,Super Bowl LII
another name for the torso is the blank region of the body,trunk
who played the oldest brother in 7th heaven,Barry Watson
how many seasons of from dusk till dawn are there,third season
what is the female lion called in lion king,Nala
name of volcano that erupted in iceland in 2010,Eyjafjallajökull
who played young monica in love and basketball,Kyla Pratt
who was the last nba player to get drafted out of high school,Thon Maker
when was the last amendment to the constitution passed,"May 5, 1992"
who has scored the most tries in rugby union,Daisuke Ohata
who is the new york state senate majority leader,John J. Flanagan
who carried the usa flag in opening ceremony,Erin Hamlin
who played dwight's brother on the office,Thomas Middleditch
who was toot toot in the green mile,A trustee
who is the actor who plays king joffrey,Jack Gleeson
when did the nest 3rd generation come out,"September 1, 2015"
how much is a 72 oz steak at the big texan,$72
what are the four requirements to establish criminal liability for gross negligence manslaughter,the defendant breached this duty
who does the voice of alistair in dragon age,Steve Valentine
who coined the phrase let get ready to rumble,Michael Buffer
who is command sergeant major of the army,Daniel A. Dailey
who is in charge of new issues not mentioned in the constitution,Congress
where does trick or treat for unicef money go,UNICEF's global programing
when was the first episode of scooby doo,"September 13, 1969"
to whom do the powers not given to the federal government by the constitution go,the states or the people
which term describes the replacement of damaged cells to mend a tissue,Stromal cells
what process causes the continents to drift apart how,Continental drift
who was the first person to successfully introduce a device exclusively designed for data processing,Herman Hollerith
prior to 1948 north and south vietnam were a part of,France
how many times has south korea held the winter olympics,two
which gene segments code for the variable region of the heavy chain,V
who won the national championship in volleyball 2017,Ohio State
the lowest temperature at which a lubricant will flow is called the,pour point
when was the last time iran had an earthquake,2017-12-20
where is the deepest lake in the us located,Oregon
when did italy enter the second world war,10 June 1940
which state is the richest state in nigeria,Lagos State
how many seasons are in star wars the clone wars,6
how many books are in the diary of a whimpy kid series,12
who played the girl in my two dads,Staci Keanan
who played the judge in good will hunting,James P. Flynn
when is the fa cup semi-finals being played,Wembley Stadium
who won the most medals in the 1924 winter olympics,Norway
when did muhammad ali win an olympic gold medal,1960
what is the largest ethnic group in mexico today,K'iche'
where are the mitochondria located in the sperm,midpiece
what's the highest point in the us,Mount Whitney
who has trained the most melbourne cup winners,Bart Cummings
book series about the end of the world,Left Behind
who sings he thinks he'll keep her,Mary Chapin Carpenter
who sings gone gone gone she been gone so long,Chilliwack
what does it mean when your baby comes out feet first,A footling breech
where was the world economic forum held this year,Davos
who is emma dating in once upon a time,Hook
when does the world cup of hockey start,2020
what is the source of information for account receivables,invoices
where is the villa in call me by your name,Moscazzano
when does a wrinkle in time come out in canada,"March 9, 2018"
new york heart association functional classification of angina,II
when was the movie cool hand luke made,1967
who sings gimme shelter with mick jagger,Merry Clayton
what is a buckeye the mascot for ohio state university,Anthropomorphic buckeye nut
the fellowship of the ring director's cut length,228 minutes
who plays addison shepherd on grey's anatomy,Kathleen Erin Walsh
who won the womens 2017 ncaa basketball tournament,South Carolina
distance from one side of a bridge to the other crossword,span
what does the adrenal gland produce that is necessary for the sympathetic nervous system to function,epinephrine
colby chees is named after a town in what state,Wisconsin
when does season 8 of hawaii five o premiere,"September 29, 2017"
what happens when iron reacts with oxygen and water,Rust
who sang it must have been love but its over now,Roxette
who did the original spirit in the sky,Norman Greenbaum
internet based test of english as a foreign language test,TOEFL
who plays rachel on jessie punch dumped love,Isabella Palmieri
who is the director of nightmare before christmas,Henry Selick
where is hallmark channel home and family filmed,"Los Angeles, California"
which term means the study of the nature and causes of disease,pathology
what is the poorest county in the state of florida,Union
who sings i can't take my eyes off of you,Frankie Valli
who plays colin on young and the restless,Tristan Rogers
how many indian astronauts have gone to space,2
what is the width of a cricket bat,no more than 4.25 inches
why did ric flair go back to wcw,February 1993
where does the light reaction of photosynthesis occur,on the thylakoid membranes
who has appeared in the most royal rumbles,Shawn Michaels
where did the last name taylor originate from,Old French
american horror story freak show girl kidnapped by clown,Bonnie Lipton
who won the most mvp awards in the nba,Kareem Abdul-Jabbar
who plays sven in the santa clarita diet,Leo Howard
who did corbin dance with on dancing with the stars,Karina Smirnoff
who plays harley quinn in the lego batman movie,Jenny Slate
how many different kinds of pokemon cards are there,eleven
what is australia's location in the world and region,Oceania
batman and robin episode only fools and horses,"""Heroes and Villains"""
who is the supreme justice of the supreme court,John Roberts
when did the government change the retirement age,2015
how oxygenated blood returns to the heart from the lungs,pulmonary circulation
who has won the most f1 grand prix,Michael Schumacher
how many games does a team have to win for the world series,best-of-seven
what happens when an air mass is pushed up and over a mountain range,Orographic lift
who said life is like a bowl of cherries,Lew Brown
who said have you no sense of decency,Joseph Nye Welch
where did the ancestors of the domestic goat originate,Iran
how many episodes in season 4 of last ship,10
what is the highest base on the ph scale,greater than 14
where is the love meaning of the song,lament on various worldwide problems
who played marius in the movie les miserables,Eddie Redmayne
who played chaka on land of the lost tv show,Phillip Paley
who sold the most records elvis or the beatles,The Beatles
bosnia and herzegovina croatia macedonia and slovenia all used to be parts of,Yugoslavia
how many quarterbacks have a receiving touchdown in the superbowl,1
how many seasons of johnny bravo are there,four
who plays drew's boyfriend on the night shift,Rick
who plays nikko in the wizard of oz,Patrick Walshe
who stole the mona lisa from the louvre in 1911,Vincenzo Peruggia
when does brooklyn nine nine season 5 episode 12,"March 18, 2018"
who played john clark sr on nypd blue,Joe Spano
who played peter benton's sister on er,Jackie Robbins
who plays the voice of john smith in pocahontas,Mel Gibson
who is the girl who played in the grinch,Taylor Michel Momsen
who wrote the theme to last of the mohicans,Dougie MacLean
when does mexico play in the winter olympics,9 to 25 February 2018
who dies in the lost city of z,Manley
when was the last time the vikings made the superbowl,in the 1970s
what is the name of the muslim dress,hijab
when does the new saw 8 come out,"October 27, 2017"
when were cigarette ads banned from tv uk,1 August 1965
who recorded i can't help falling in love with you,Elvis Presley
when did india win their first cricket match,1952
when does grey's anatomy come back on in march,"March 1, 2018"
what channel does thursday night football come on regular tv,NBC
who is new prime minister of italy 2018,TBD
what is the speed of the nascar pace car,pit road speed
who won the silver medal in womens figure skating,Evgenia Medvedeva
who was the first imperial power that was fighting in vietnam,France
who is the captain of richmond football club,Trent Cotchin
who is the first indian climber of mount everest,Bachendri Pal
who votes to elect a rajya sabha memmber,state legislatures
how many episodes curse of oak island season 5,18
who played mr thatcher in when calls the heart,Garwin Sanford
who plays cesar in the show on my block,Diego Tinoco
who was the pinkerton detective agency's first female detective,Kate Warne
who played harley in harley davidson and the marlboro man,Mickey Rourke
where did they get the vibranium to make captain americas shield,Wakanda
who plays the short cop on will and grace,Ryan Pinkston
what is loihi and where does it originate from,from the Hawaii hotspot
anastomosis between the epididymis and the vas deferens,Vasoepididymostomy
who played ricky in secret life of the american teenager,Daren Maxwell Kagasoff
what is the meaning of the name sinead,God forgave/God gratified
in florida it is illegal to sell alcohol before 1 pm on any sunday. this is an example of,Blue laws
who played the original wonder woman on tv,Lynda Carter
the man in the high castle episode 1 season 1,The New World
who is the voice of the other mother in coraline,Teri Hatcher
when was the last time the dodgers played yankees in the world series,1981
who has the highest paid contract in the nba,Stephen Curry
who got the most passing yards in the nfl,Peyton Manning
bacterial cell walls are made rigid by the presence of,Peptidoglycan
how many medals did austria win in the 2011 alpine skiing world championships,8
when did the flash first appear on arrow,second season
when did the continental congress vote to adopt the declaration of independence,"July 2, 1776"
where does the us launch space shuttles from,Florida
a country having an island location and a country having continental location,Australia
when were 7 books removed from the bible,1546
what percentage of global man-made co2 emissions comes from worldwide aviation,4 percent cumulative effect
how long has tom brady been playing professional football,18-season career
what is one element a topographic map shows,relief
spyder from once upon a time in venice,Jason Momoa
who won mark and goal of the year 2017,Joe Daniher
who said i'll gladly pay you tuesday,Wimpy
where is the 7th game of the world series played,"Dodger Stadium, Los Angeles"
what side does us army go on acu,the right
who sang it's a mean old world,T-Bone Walker
who was the inventor who developed a way to record sound,Thomas Edison
who became a leader of the indian national congress,Mahatma Gandhi
who has the most sacks in college football,Mike Czerwien
what does zonia receive from reuben in the play,kiss
who is the guy who walked across the twin towers,Philippe Petit
turkish finnish and hungarian belong to which family of languages,Uralic languages
who sponsored the phoenix open before waste management,Friedman Billings Ramsey
who came up with the theory of relativity,Albert Einstein
where does prime rib come from on a cow,the primal rib
what does it mean to fuse the spine,joins two or more vertebrae
who took control of jamestown and made new rules that made everyone work,John Smith
who presides over the highest criminal court in a district,District Judge
who played stonewall jackson in gods and generals,Stephen Lang
who won britain's next top model 2016,Chloe Keenan
where do they film take me out fernando's,Club Bijou on Chapel Street
who played booster in jingle all the way,Curtis Armstrong
what was the united states foreign policy after ww1 started,neutrality
which nfl coach has the most superbowl rings,Bill Belichick
who wrote the theme song for the winter olympics,Leo Arnaud
when did little polveir win the grand national,1989
when is the next episode of flash airing,"May 8, 2018"
when did the democratic party change its name,the 1830s
who did michael showers play on vampire diaries,The Man
where does the largest amount of federal tax revenue come from,California
where does wild caught sockeye salmon come from,the Northern Pacific Ocean
who is the girl that played darlene in roseanne,Sara Gilbert
who does tyler end up with in you get me,Ali
when was i look at the world poem written,30–31 October 2000
what is the year round weather in dubai,tropical desert climate
who played g baby in the movie hardball,DeWayne Warren
when was where have all the flowers gone written,1955
when was the wheel introduced to north america,about 1500 BC
who was named african footballer of the year 2014,Yaya Touré
who formed and first came to the colony of maryland,the English
what is the biggest town in west virginia,Charleston
who died in the first episode of stranger things,Benny
who plays zoey in i love you man,Rashida Jones
which is the default file extension for an audio file in windows media player,Windows Playlist (WPL)
to aru kagaku no railgun s episode 3,Project Radio Noise
1 the bureau of land management manages over acres of land in the united states,247.3 million
who said everyone will be famous for 15 minutes,Andy Warhol
when does the new adventure time come out,"April 21, 2017"
dynamin is associated with which type of vesicle,newly formed vesicles
who made the nuclear model of an atom,Ernest Rutherford
when does the little couples new season start,"September 19, 2017"
who played mrs warboys in one foot in the grave,Doreen Mantle
who does tony end up with on skins,Michelle
what is the population of fayetteville north carolina,"204,408 in 2013"
who owns the biggest house in beverly hills,Anthony Pritzker
when is the flash coming back after christmas,"January 16, 2018"
where do the signals for apoptosis come from,from other cells
when did the battles of lexington and concord happen,"April 19, 1775"
who has the most number one single hits,The Beatles
where did the river thames start and end,"Thames Estuary, North Sea"
where is a simple gear train used in real life,Automobile drivetrains
when was the last time the seattle seahawks won the superbowl,2013
who said one man's vulgarity is another's lyric,Justice Harlan
who does claire from mcleods daughters end up with,Alex Ryan
what's the dwarf's name in game of thrones,Tyrion Lannister
who plays the queen in victoria and abdul,Judi Dench
when is last time the astros won the world series,2017
when did drop it like it's hot release,"September 12, 2004"
china in chinese is called zhongguo which means,Central States
what is the name of the compound p4010,Phosphorus pentoxide
who played joey's agent estelle on friends,June Gable
who is the sixth president of the united states,John Quincy Adams
who won the food network star in 2016,Tregaye Fraser
where did this case of product tampering occur,the Chicago metropolitan area
what happens to water that infiltrates the soil if it is not absorbed by the roots of plants,runoff
who plays bianca in that's so raven,Erica Rivera
the south west wind blows across nigeria between,till September
who is the lead singer of collective soul,Ed Roland
who is known as the father of indian constitution,Bhimrao Ramji Ambedkar
when did the united kingdom entered world war 2,1939
where does jack ryan live in patriot games,"Baltimore, Maryland"
when does season 8 for blue bloods start,"September 29, 2017"
nobel laureate who began career as accountant in calcutta,Amartya Sen
what order do the captain america movies go in,Captain America: Civil War
how many times have the golden state warriors been to the playoffs,nine
who plays emma in air bud world pup,Brittany Paige Bouck
who was the qb for the saints before drew brees,Aaron Brooks
when was the last time someone won the super bowl back to back,2004
who has the best nba record this season,Houston Rockets
who was the main character in their eyes were watching god,Janie Crawford
who bowled the last over of the 2007 world twenty20 that india won,Pakistan
when is the last time wisconsin missed the ncaa tournament,1997–98
mention the chemical change that proinsulin undergo to be able to act as mature insulin,post translational modification
who is the girl in the hinder video lips of an angel,Emmanuelle Chriqui
when did the name of bombay change to mumbai,1995
when does season 7 game of thrones dvd release,"December 12, 2017"
what is the origin of the word celsius,the Swedish astronomer Anders Celsius
what is the official slogan for the 2018 winter olympics,Passion. Connected.
who plays justin on the haves and the have nots,Nicholas James
who sings only love can break your heart,Neil Young
