input_text,answer
when did the eagles win last super bowl,2017
who won last year's ncaa women's basketball,South Carolina
when did the isle of wight become an island,During the last Ice Age
love yourself by justin bieber is about who,Rihanna
who was the ruler of england in 1616,James I
what is the hot coffee mod in san andreas,a normally inaccessible mini-game
what is the maximum data rate for the 802.11a standard select one,54 Mbit/s
who sang i ran all the way home,The Impalas
where did the last name wallace come from,a Scottish surname
who was the actor that played ben stone on law and order,Michael Moriarty
who plays gram on the young and the restless,Max Shippee
what is the oath that new citizens take,United States Oath of Allegiance
who is under the mask of darth vader,Anakin Skywalker
what age do you need to be to buy a bb gun,18
ethiopia flight 961 crashes in to the sea,23 November 1996
who plays auggie in the movie the wonder,Jacob Tremblay
who plays matthew on anne with an e,R. H. Thomson
who is the girl in green day 21 guns,Lisa Stelly
who plays joker in batman the dark knight,Ledger
who did bette midler portray in the rose,Mary Rose Foster
who is the lead singer of depeche mode,David Gahan
where did the butchers in the slaughterhouse cases live,New Orleans
who developed the concept of total quality management,W. Edwards Deming
who has the power (judicial) to make decisions in courts of law,judges
i was a great islamic scholar and mathematician who died in 1131 ce,Omar Khayyam
who is the coach for the ottawa senators,Guy Boucher
last episode of what happens to my family,53
where is lord's prayer found in bible,in the Gospel of Luke
what is the meaning of veronica in english,she who brings victory
who played solomon in little house on the prairie,Todd Bridges
who does eric end up with in that 70s show,Donna
who wrote papa got a brand new bag,James Brown
what's the dog's name on tom and jerry,Spike
where does the path train stop in newark,Newark Penn Station
where does route 66 start on the west coast,in Santa Monica
who is the first wife on sister wives,Meri
when did houston go to the american league,2013
coldplay song i will try to fix you,"""Fix You"""
points on a sphere or angles in a circle are measured in units called,radians
the oligodynamic effect is a phenomenon that describes,a biocidal effect of metals
where does the white witch live in narnia,her castle
when was corporal punishment banned in south africa,1997
who plays captain phasma in star wars the force awakens,Gwendoline Christie
when did marathon change its name to snickers,19 July 1990
who captained the first european ship to sail around the tip of africa,Bartolomeu Dias
who ordered the forbidden city to be built,Zhu Di
who sang let me tell you about the birds and the bees,Jewel Akens
who has the power to approve or veto legislation constitution,the President
who is the minister of local government in zimbabwe,Hon July Moyo
what was the initial effect of the transition from command to market economies in eastern europe,Inequality of opportunity
who plays the saint of killers on preacher,Graham McTavish
jonny cash one piece at a time car,Cadillac
when did amnesia the dark descent come out,8 September 2010
where is the tibia and fibula bone located,leg
who played bat masterson in the tv series,Gene Barry
who sings sugar sugar you are my candy girl,the Archies
who plays noah newman on the young and the restless,Robert Gillespie Adamson IV
who has won the most games in nfl 2017,Dallas Cowboys
who has the most catches in nfl history,Jerry Rice
when does the dlc for rainbow six siege come out,January 2018
when does season 5 of the blacklist resume,"January 31, 2018"
how much money did it cost to make gta v,137
who was the famous scientist that ran the research lab moseley went to in manchester,Sir Ernest Rutherford
who does stefan marry in the vampire diaries,Caroline Forbes
hazels boyfriend in the fault in our stars,Augustus Waters
when does the day of the dead end,November 2
where does new york drinking water come from,the eastern Catskill Mountains
where is the citrus bowl held this year,Camping World Stadium
who plays alec ramsay in the black stallion,Kelly Reno
who plays dusty in the movie pure country,George Strait
how many gold medals did australia win in the 2000 olympics,16
who started ww2 and how did it start,Nazi Germany
when did bird is the word come out,1963
how tall is the actor who plays hagrid in harry potter,6ft 1in
who performed the first c section in 1794,Dr. Jesse Bennett
who voices randy in f is for family,T.J. Miller
bible verse taking the lord's name in vain,Exodus 20:7
when does thomas rhett's new album come out,"September 8, 2017"
who won the champions league final in 2016,Real Madrid
who is the real killer in basic instinct 2,Catherine Tramell
where did the dewey decimal system come from,Melvil Dewey
where did the jungle book story come from,English author Rudyard Kipling
derek and meredith get back together season 3,Staring at the Sun
who did america declare war on in ww1,Austria-Hungary
who played zoe hart on hart of dixie,Rachel Sarah Bilson
what was tom hanks character name in castaway,Chuck Noland
what engine is in a holden v8 supercar,V8-engine
when did the rational dress society begin to work,1881
what is the baby elephants name in jungle book,Hathi Jr.
who is the biggest selling female group of all time,Spice Girls
where was the first session of the assam association held in1905,Guwahati
when is season 2 of jessica jones being released,"March 8, 2018"
when was united nations convention on the rights of the child created,20 November 1989
swan lake the sleeping beauty and the nutcracker are three famous ballets by,Pyotr Ilyich Tchaikovsky
who is jared on the bold and the beautiful,Andrew Collins
who wrote knock knock knocking on heavens door,Bob Dylan
who plays chummy's mother in call the midwife,Cheryl Campbell
where do they put the tomb vampires in order to burn them during founders day,the Gilbert building
where is gall bladder situated in human body,beneath the liver
what is the current population of bora bora,"10,605"
which is produced in plants of narora kakrapar tarapur,Atomic Power
what is the first book of percy jackson,The Lightning Thief
who was originally cast to play indiana jones,Tom Selleck
who played amy grant i i can only imagine,Nicole DuPort
who sings the song only in my dreams,Debbie Gibson
who appoints the chair of the federal reserve system,President of the United States
when does body temperature tend to be lowest,11 p.m. to 3 a.m.
what is the function of a political action committee (pac),pools campaign contributions from members
who is president of india in present time,Ram Nath Kovind
what role does the president play in foreign affairs,negotiates treaties with foreign nations
what grade was arnold from hey arnold in,fourth
when does the miz and maryse show start,2018
what is on top of us capitol building,The Statue of Freedom
who made the most free throws in nba history,Karl Malone
why does kerosene oil rise up in the wick of lantern,capillary action
how many episodes of season 5 of curse of oak island,18
how many episodes of touching evil are there,16
hyori bed and breakfast season 2 air date,"February 4, 2018"
who has the most gold medals in the winter olympics of all time,Norway
when is the fourth movie of the divergent series coming out,never made
the outer layer of the skin that contains no blood or nerve supply is the,epidermis
which country has the most coastline in the world,Canada
who won battle of the sexes tennis game,Billie Jean King
who won in the brown vs board of education case,defendants
when did the word of wisdom become mandatory,February 1834
element named after fictional planet from which superman came,Kryptonite
who developed the central processing unit (cpu),John von Neumann
what is katie running from in safe haven,her abusive husband
when did they replace lead with graphite in pencils,never contained the element lead
what started the war between us and japan,attack on Pearl Harbor
when does sam realize he is jim in ghost whisperer,Leap of Faith
what size engine does a 2005 honda civic have,1169 cc
who sang the superbowl national anthem in 2017,Luke Bryan
which country has won maximum number of gold medal in asian game 2014,China
which country is the last member of saarc,Afghanistan
who plays timon in lion king on broadway,Max Casella
what caused the breakup of the democratic republican party,the disputed 1824 presidential election
who has won the most college football national champions,Princeton
what is the meaning of the dragon boat festival,commemorating fealty and filial piety
what was the real name of saudi arabia,the Saudi Arab kingdom
what is the function of the pericardial sac,Lubricates the heart
chris cornell she's going to change the world,Can't Change Me
who played the colorado kid in rio bravo,Ricky Nelson
other than water what else has hydrogen bonds,inorganic molecules such as water
where was when we first met netflix filmed,New Orleans
who was the viceroy when the simon commission visited india,Lord Irwin
when did the united states host the world cup,1994
number 4 in roman numerals on clock faces,IV
who won the super heavyweight gold medal at the 2000 olympics,Audley Harrison
who turns into a bear in the hobbit,Beorn
batman the enemy with episode 5 release date,"March 27, 2018"
yeh hai mohabbatein serial star cast real name,Divyanka Tripathi and Karan Patel
who owns the crown plaza hotel in chicago illinois,InterContinental Hotels Group
when was the last time the eu was audited,1994
the legend of heroes trails in the sky the 3rd vita,"July 14, 2016"
when was a series of unfortunate events published,September 1999
who will win 2018 election in sri lanka,Sri Lanka Podujana Peramuna
what is the name for the ch3coo- ion,polyatomic anion
what type of government did the ming dynasty have,imperial rule
when was rosencrantz and guildenstern are dead written,1966
who sang picking up pebbles and throwing them into the sea,Matt Flinders
how many breeds of pigs are there in the uk,---
who played shmuel in the boy in the striped pyjamas,Jack Scanlon
where is the capital city of alabama located,Montgomery
where is the highest level of fluoride stored in the teeth,surface of the enamel
when was as you like it first performed,1603
when was the latest version of chrome released,2018-01-22
who made delhi as capital for the first time,the Pandavas
who is tinker air force base named after,Major General Clarence L. Tinker
who has the most all ireland hurling medals,Henry Shefflin
who hit the first home run in the houston astrodome,Mickey Mantle
when did the eagles play in the superbowl,"February 6, 2005"
when will fairy tail final season be released,2018
when did seat belts become law in ontario,"January 1, 1976"
when does madea's family funeral come out,2018
who lasted the longest in the royal rumble,Rey Mysterio
what does hp mean in war and order,hit points or health points
who is given credit for the gnu initiative,Richard Stallman
who is edmund on days of our lives,Adam Caine
what is an example of a tricyclic antidepressant,Amineptine
when was the canadian pacific railway started and finished,between 1881 and 1885
who played the creature on jeepers creepers 3,Jonathan Breck
who plays unis in she's the man,Emily Perkins
who played the mom on what's eating gilbert grape,Darlene Cates
sri lanka belongs to which part of asia,South Asia
who plays the dad in nanny mcphee and the big bang,Ewan McGregor
when was the taming ofthe shrew first performed,prior to June 1592
when was the last time giants won superbowl,2011
to transplant a nucleus from one cell to another cell a scientist would use,somatic cell nuclear transfer
who plays general hux in the last jedi,Domhnall Gleeson
when was the last time new zealand had an earthquake,11 Jul 2017
who is the actor that plays dr. sean murphy,Freddie Highmore
who played gino in a place to call home,Aldo Mignone
what does the pearl symbolize in the bible,the Kingdom of Heaven
who holds the world record for the most world records,Ashrita Furman
who is the designer in devil wears prada,Valentino Garavani
where does dividends go on cash flow statement,the financing activities section
when was the 50th star added to the united states flag,1960
what is the ethnic background of the shib sibs,Japanese
who was mr.owen in and then there were none,Justice Lawrence John Wargrave
what season does bart bass die in gossip girl,)
who is the first indian woman to be canonized as a saint,Saint Alphonsa
how many episodes of corrie has there been,"9,436"
when do primary ossification centers appear in an embryo,prenatal development
when was the biltmore house opened to the public,March 1930
where does hydrogen peroxide come from in the body,nearly all living cells
where was the killing of a sacred deer filmed,Cincinnati
who plays hannibal in silence of the lambs,Anthony Hopkins
who plays the dragon queen from game of thrones,Emilia Clarke
when is the publishers clearing house sweepstakes drawing,just after the Super Bowl
who played the elephant man in the film,John Hurt
when is the met office leaving the bbc,31 March 2018
who plays heather in beauty and the beast,Nicole Gale Anderson
who is jack's mother in when calls the heart,Charlotte Thornton
when did the the regulatory reform (fire safety) order 2005 first come into effect,1 October 2006
who was elected president in mexico in 2000,Vicente Fox
when does season 6 of the next step start,2018
abbreviated name of the highest peak in tasmania,Mount Ossa
who played alex cross in along came a spider,Morgan Freeman
who has the most wins on around the horn,Woody Paige
who sang the song i wanna be sedated,the Ramones
what is the setting of the book hoot,Florida
when is season 3 of grace and frankie being released,"March 24, 2017"
what does the sun represent on the uruguay flag,the May Revolution of 1810
why was hong kong important to the british empire,a centre for international trade
when did skiing halfpipe become an olympic event,2014
where was the first colony in north america located,Virginia
during the first world war against which country germany did not fight,Austria-Hungary
product-market fit means being in a good market with a product that can satisfy that market,Mark Andreessen
who does bryce dallas howard play in the grinch,Surprised Who
who plays the robot on the orville show,Mark Jackson
how many wars held between india and pakistan,four
when was the young and the restless first aired,"March 26, 1973"
who has won 2017 women's singles korean open series badminton championship,P. V. Sindhu
what is the full form of cfc's,Chlorofluorocarbons
who does eric end up with in gossip girl,Jenny
when was the first temple built in jerusalem,the mid-10th century BCE
when did the steel mills closed in youngstown ohio,"September 19, 1977"
when was the last time the jets won a playoff game,2010
is it marley and me or marley and i,Marley & Me
when did vat change from 17.5 to 20,4 January 2011
who sings too much time on my hands lyrics,Tommy Shaw
nba record for most double doubles in a season,Tim Duncan
who is super bowl 2018 half time show,Justin Timberlake
who became the king of ayodhya after ram,Kusha
what album is help by the beatles on,Help!
who was the king of england in 1756,George II
where is the left anterior descending artery located,the left coronary artery
who sings every light in the house is on,Trace Adkins
what is the meaning of the harp in ireland,the arms of Ireland
when does like cage season 2 come out,"June 22, 2018"
who is jojo in horton hears a who,Jesse McCartney
this poster was created to increase support for the war effort.the poster links food rationing to,aiding the war effort
when did mcdonald's sell 1 million burgers,By 1965
what are the power of supreme court in the philippines,Justices
when does the last episode of adventure time air,TBA
how many paintings of sunflowers did van gogh paint,two
how many ceos of fortune 500 companies are female,32
where is the orinoco river located on a map,in South America
when was the last time the boston red sox pitched a no-hitter,"May 19, 2008"
who was the french chef given credit for developing the classic kitchen​ brigade,Georges Auguste Escoffier
who plays the dad in pretty in pink,Harry Dean Stanton
when do the new episodes of supernatural start,"May 10, 2018"
who won the award for best goalkeeper in football world cup 2006,Gianluigi Buffon
what is upstream project in oil and gas,drilling exploratory wells
what was the final episode of quantum leap,"""Mirror Image"""
when was the first election held in india,1951–52
who has been appointed as the election commissioner of india,Om Prakash Rawat
who played tom in four weddings and a funeral,James Fleet
where did huntington's disease get its name,the physician George Huntington
when was the last time michigan won the championship,1989
who did deion sanders go in the hall of fame as,Cornerback
who was originally cast as phoebe on charmed,Lori Rom
who turned out to be the mother on how i met your mother,Tracy McConnell
whos jack the ripper in gotham by gaslight,Jacob Packer
who sings the christmas song mary did you know,Michael English
who sang gonna sit right down and write myself a letter,Fats Waller
who picks the players in the nfl draft,each team
when did we first put a rover on mars,January 2004
who won game 4 of the 2000 nba finals,Los Angeles Lakers
when was the last grand slam hit in the world series,2016
when does episode 29 of boruto come out,"October 18, 2017"
what is the origin of the name robinson,English language patronymic surname
how long has it been since eagles went to super bowl,2018
who built the tower of london in 1066,William the Conqueror
who overthrew the mongols and established the ming dynasty,Zhu Yuanzhang
when was the first book made into a movie,1924
when did tim hortons open in the usa,1981
when is the next scandal episode coming out,"February 1, 2018"
where does the ohio river and the mississippi river meet,"Cairo, Illinois"
when did they start assigning social security numbers at birth,1990
what are the names of the hunger games,The Hunger Games
where does safe haven take place in the book,"Southport, North Carolina"
who played jason in friday the 13th the final chapter,Ted White
state the position of india in terms of population size,second
real name of daya in taarak mehta ka ooltah chashmah,Disha Vakani
when does the shape of water book come out,"March 6, 2018"
who discovered that neural communication between cells occurs through chemicals,Charles Sherrington
who may be affected by monetary penalties imposed by the irs,Taxpayers in the United States
where did they film ghosts of girlfriends past,Massachusetts
what was icq as related to instant messaging,an instant messaging client
how many episodes in adventure time season 1,26
when did the us stop drafting for the vietnam war,1973
when will the next episode of flash be aired,"May 15, 2018"
who plays izabella in transformers the last knight,Isabela Moner
when did fender start making amps in mexico,1996
where will be the next olympics be held,Tokyo
name of the boundary line between india and bangladesh,International Border (IB)
what tectonic setting is responsible for the folded mountains of pennsylvania and the high himalaya,a convergent plate boundary
when does dragon ball super episode 130 comes out,"March 18, 2018"
what percentage of the population is naturally blonde,2%
how long did it take to build the great pyramid of egypt,20-year period
where in the constitution is the executive branch referenced,Article Two
who plays mr wilson in dennis the menace,Joseph Sherrard Kearns
when did rob dyrdek's fantasy factory end,"March 5, 2015"
who was the girl in the video brenda got a baby,"Ethel ""Edy"" Proctor"
who discovered that plants were made of cells,Parashara
when did disney art of animation resort open,"May 31, 2012"
do you have to have a gun permit to shoot at a range,"Typically, no"
the area enclosed by hysteresis loop is a measure of,energy loss
when did rachel have her baby on friends,"May 16, 2002"
who has been designed as the new finance secretary of india,Hasmukh Adhia
when did last podcast on the left start,2011
who won first ancient olympic 200 yard race,Coroebus of Elis
who played major hochstetter in hogan's heroes,Howard Caine
who played nicky on the drew carey show,Kate Walsh
who had the most governmental power under the articles of confederation,the states
yo la tengo theres a riot going on release date,"March 16, 2018"
when did athens emerges as wealthiest greek city state,the late 6th century BCE
what us president is the only president to become an eagle scout,Ford
how many episodes are in chicago fire season 4,23
who played maudie in the movie el dorado,Charlene Holt
who does marge's voice on the simpsons,Julie Deborah Kavner
who is the drummer for guns and roses,Frank Ferrer
when did the first junie b jones book come out,1992
who is the number one ranked golfer in the world right now,Dustin Johnson
who plays the mouse in alice in wonderland,Barbara Windsor
which organelle is the site of atp production and storage,mitochondrion
who played gareth in four weddings and a funeral,Simon Callow
where did the term hot rod come from,southern California
when did the military plane crash in mississippi,"July 10, 2017"
who has the most international goals of all time,Ali Daei
who played bat masterson in the movie tombstone,Mason Alan Dinehart
tools made from high-speed tool steel are generally used for what type of machining operations,milling
where does the this is us family live,Pittsburgh
when did fortnite battle royal come out on xbox,September 2017
when do you get your white coat in pharmacy school,before the first year begins
when did the ouija board game come out,"July 1, 1890"
who played desmond doss father in hacksaw ridge,Hugo Weaving
who is the founder of the ubuntu project,Mark Richard Shuttleworth
for complaints of sudden chest pain patients should take a,Aspirin
name the cell which is attached to the lateral side of sieve tube,sieve tube elements
who won the first celebrity big brother on channel 5,Jack Dee
where was the movie strangers prey at night filmed,"Covington, Kentucky"
how did the dominican republic get its name,"patron saint, Saint Dominic"
who played the mother in the black stallion,Teri Garr
when is the end of the football season,"February 4, 2018"
where is geothermal energy used the most in the us,California
when did jack mccoy join law and order,1994
where was the u.s.s maine when it exploded in 1898,Havana Harbor
who sings the original windmills of your mind,Noel Harrison
what color pages in the emergency response guidebook (erg) list compounds by name,blue
what is alpha centauri's approximate distance from earth,4.37 light-years
what is the weight of a honda fit,"1,020–1,080 kg"
when will the 2018 oscar nominations be announced,"January 23, 2018"
who is the father of lucius in gladiator,Lucius Verus
guardians of the galaxy blue guy in prison,Michael Rooker
of which country is sofia the capital city,Bulgaria
what is the legal age for marriage in australia,18
who won women's singles us open 2017,Sloane Stephens
who is the actor that plays jt on the young and the restless,Thaddeus Rowe Luckinbill
who did the mavericks beat in the finals,Miami Heat
is coca cola a public or private company,Public
was star wars a book or a movie first,film
when did beds become popular in france and germany,the 12th century
who owns the golden nugget casino in atlantic city,"Landry's, Inc."
where are the spanish steps located in italy,Rome
who is mostly responsible for writing the declaration of independence,Thomas Jefferson
where did they film woody the woodpecker movie,Canada
what is the second largest country in asia,China
star trek the next generation season 3 episode 24,"""Ménage à Troi"""
what was the alliance between great britian russia and france known as,The Triple Entente
who won the oscar for best actor in 1975,Art Carney
who sings you are a magnet and i am steel,Walter Egan
where is the tv show the curse of oak island filmed,Oak Island
who picks the chief justice of the illinois supreme court,the court
where does the show the path take place,Upstate New York
who was the first territorial governor of oklahoma,George Washington Steele
when does kc undercover season 3 episode 10 air,"November 10, 2017"
who plays the lion in the movie zookeeper,Sylvester Stallone
who is doing 2018 super bowl half time show,Justin Timberlake
which level of weight bearing often comes with a set number of pounds,Partial weight-bearing
who became the it company ceo in 2016,Abid Ali Neemuchwala
who plays genie in ferris bueller's day off,Jennifer Grey
who sang national anthem at the super bowl,Pink
number of films in lord of the rings,three
where do the phaeacians live in the odyssey,Scheria
who scored the most points in a game nba history,Wilt Chamberlain
who started the state of the union address,Woodrow Wilson
when was the last time clemson won the national championship,2016
where did they film season 8 of the walking dead,Georgia
who sings the theme song for living single,Queen Latifah
who plays ivo on once upon a time,Dan Payne
who plays brad pitt's daughter in moneyball,Kerris Lilla Dorsey
who sang the songs in the movie beyond the sea,Kevin Spacey
last world series that didn't go 7 games,2015
who sang our god is an awesome god,Rich Mullins
