input_text,answer
what territory is spain and the united kingdom in a dispute over,Gibraltar
when was you'll never walk alone first released,1945
atlantic ocean's shape is similar to which english alphabet,S
where did the titanic sink at what ocean,North Atlantic Ocean
dogs name in the grinch who stole christmas,Max
when does the next episode of rebels come out,"February 19, 2018"
perth is the capital of which australian state,Western Australia
who gets the golden boot if its a tie,shared
when does a cell have condensed visible chromosomes also known as sister chromatids,metaphase
is greenland part of europe or north america,North America
the boiling point of water is 100 degrees celsius express this in si units,100 °C
what's the nba record for most points in a half,59
where does the last name tavarez come from,Spanish
who shot first in the shot heard around the world,Americans acting under orders
who has won the 2017 mens singles mutua madrid open tennis,Rafael Nadal
when did linkin park release one more light,"May 19, 2017"
created propaganda to support the war effort & encourage the sale of war bonds,the government
what us state forms the western boundary of montana,Idaho
where does the edinburgh fringe festival take place,"in Edinburgh, Scotland"
first dynasty to issue gold coins in india,The Gupta Empire
how many games does a football team have to win to be bowl eligible,5
where does the journey start in the canterbury tales,London
when was the first time lebron went to the finals,2007
who has made the most premier league appearances,Gareth Barry
when was the last time it snowed in england on christmas day,2009
when does the movie the star come out,"November 17, 2017"
first who wants to be a millionaire winner uk,Judith Cynthia Aline Keppel
actor who played caesar in dawn of the planet of the apes,Andy Serkis
where is the north pole on the world map,latitude 90° North
who played sam in clarissa explains it all,Sean O'Neal
who commissioned the first christmas card in 1943,Sir Henry Cole
where was the new pete's dragon filmed,New Zealand
total goals scored by ronaldo in la liga,309
who's opening for foo fighters at fenway,N/A
when did the eagles last play in a superbowl,2017 season
the world's tallest jain statue is located in which state of india,Maharashtra
when did hyderabad became a part of india,24 November 1949
when does wonder woman come out on blue ray,"September 19, 2017"
what time is it in alaska time zone,UTC−09:00
when is winter big brother going to start,"February 7, 2018"
who is the quarterback for the green bay packers,Aaron Rodgers
who played the face in the a team,Dirk Benedict
where did the battle of bonhomme richard take place,near Flamborough Head
who is the original singer of fool if you think it's over,Chris Rea
who has played in the most masters tournaments,Gary Player
what are some special products made in mississippi,farm-raised catfish
how many numbers are in the euromillions draw,7
who was the buccaneers qb when they won the superbowl,Brad Johnson
how many episodes in season 3 of good witch,10
who is the best director in bollywood 2017,Nitesh Tiwari
when did the term sustainability start to be used,1987
who played emma in h2o just add water,Claire Rhiannon Holt
when does i'm a celebrity get me out of here start in the uk,2018
who plays meredith quill in guardians of the galaxy 2,Laura Jane Haddock
how many terms can a mayor serve in texas,two four-year terms
who wrote hallelujah i just love her so,Ray Charles
where will the cricket world cup 2019 be held,England and Wales
where does sleeping freshmen never lie take place,J.P. Zenger High
word that means separation of church and state,separationism
actor who plays dr avery on grey's anatomy,Jesse Wesley Williams
when does season 13 of america's got talent premiere,"May 29, 2018"
which animal on earth has the longest life span,tortoise
what is the name of india 29 state,Rajasthan
when was the last time miss texas won miss america,1975
two atoms of the same element that are covalently bonded,shared pairs or bonding pairs
what is don quixote's horse's name,Rocinante
who played morticia in the addams family tv show,Carolyn Sue Jones
who sang i'm gonna run away from you,Tami Lynn
where did remember the titans camp take place,Gettysburg College
what is the most fundamental unit of life according to the cell theory,cells
how many national parks are present in india,103
the atomic number of indium which belongs to 5th period is,49
where does the synthesis of new dna from existing dna occurs,origins of replication
who plays the prosecutor on law and order svu,Raúl Eduardo Esparza
when did the ship hector arrived in pictou,1773
where is bigg boss tamil house is located,Chennai
who played doctor smith in lost in space,Jonathan Harris
points outside the production possibilities curve represent combinations of products that are,unattainable
where is dancing on ice filmed this year,RAF Bovingdon
who sang the theme song for laverne and shirley,Cyndi Grecco
when did the last volcano erupt in iceland,2010
what nfl team is robert griffin the third playing for,currently a free agent
who did the united states fight in the war of 1812,United Kingdom
india's first arctic research station set up in 2008 what is the name,Himadri Station
why does cooling water run through the condenser,condense the steam
what is the name of son of lord krishna,Pradyumna
what does rt mean on a dodge car,Road/Track
who played mike stivic on all in the family,Rob Reiner
who plays the grandmother in game of thrones,Rigg
what was the main characteristic of post-world war ii american society,strong economic growth
who is playing halftime at the pro bowl,Jordan Fisher
what are the importance of rigor mortis in meat processing,tenderness of meat
right to property according to the constitution of india is a,constitutional right
is aluminium a ferrous or non ferrous metal,non-ferrous
what does a yellow 35 mph sign mean,advisory speed limits
who came in last place on amazing race,Kevin & Jenn
when do you pray the chaplet of divine mercy,Good Friday
who was the dj on in living color,DJ Twist
who made the first to record with the electric guitar,George Warren Barnes
when does the new season of law and order svu come on,"September 27, 2017"
who sing say you won't let go,James Arthur
who is credited with developing the geocentric view,Ptolemy
where was the first high level language operating system created,at IBM
a legislative act passed by congress is an example of,statutory law
who plays the voice of chucky in seed of chucky,Brad Dourif
what is the latest version of microsoft office 2010,14.0.7182.5000
where is the battle of britain flight based,RAF Coningsby in Lincolnshire
who is the president of usa right now,Donald Trump
who sang the song suddenly with olivia newton john,Cliff Richard
where does the movie proof of life take place,The Republic of Tecala
who was involved in the mapp vs ohio case,Dollree Mapp
who was the sixteenth century physician who published,Andreas Vesalius
what breed of dog is the teddy bear dog,Zuchon
how many levels are there on the eiffel tower,three
how many episodes in 1st season of the crown,10
who was the first chief minister of west bengal,Prafulla Chandra Ghosh
who is the originator of the plan-do-check-act model of performance improvement,W. Edwards Deming
which supreme court judge has surved in international court of justice,Dalveer Bhandari
who gave the famous objective co relative theory,T.S. Eliot
who is the first prime minister of france,Michel Debré
who played truman capote in in cold blood,Philip Seymour Hoffman
who eliminated costa rica in world cup 2014,Netherlands
what is the name of the weapon the grim reaper carries,scythe
who won the first season of america's got talent,Bianca Ryan
in the early 1800s california society was dominated by which group,Spanish
gestational sac and yolk sac but no baby at 7 weeks,an anembryonic gestation
when is the last time the us lost the olympics,2018 Pyeongchang
why dry ether is used in woods reaction,to form a higher alkane
where does the phrase train of thought come from,Thomas Hobbes in his Leviathan
who were the first kings to issue coins bearing their names,the Indo-Greek kings
when did red bull come to the united states,1997
star wars the clone wars season 3 episode 1,Clone Cadets
is the united states a country or nation,country
who has the most podium finishes in australia,Michael Schumacher
when did john steinbeck write of mice and me,1937
who plays faith on when calls the heart,Andrea Brooks
how many seasons of prison break are on netflix,five
when does the turn of the screw take place,1898
who is the longest serving member of the house in history,John Dingell
when did first fast and furious come out,2001
what kind of fish live in the salton sea,tilapia
who wrote put your hand in the hand of the man who stilled the water,Gene MacLellan
where is the white castle that harold and kumar go to,in Cherry Hill
who headed the 7th central pay commission of india,Justice A.K Mathur
where is season 3 of the detour filmed,Alaska
who plays the voice of sulley in monsters inc,John Goodman
largest state in the us by land mass,Alaska
who used to present i'm a celebrity now,Ant & Dec
what is the longest panic at the disco song title,Bohemian Rhapsody
who played mark on the show the rifleman,John Ernest Crawford
where does the last name orozco originate from,Spanish/Basque origin
when did marley die in a christmas carol,"December 24, 1836"
where does a girl wear an engagement ring,left hand ring finger
when did i ain't mad at cha come out,"September 15, 1996"
what happened to the west wing of the white house during a christmas party in 1929,electrical fire
who played tom hagon in the godfather series,Robert Duvall
who sings the theme tune to mum on bbc2,Lulu and the Lampshades
the general term for software that is designed to damage disable or steal data is,Malware
what kind of plate boundary is nepal on,orogenic belt
the basic steps of rational decision making include defining goals and,Implementation of plans/policies
who wrote if she knew what she wants,Jules Shear
who ruled the ottoman empire in the 1500s,Selim I
song have i told you lately i love you,Have I Told You Lately
eukaryotes have how many origins of dna replication,"up to 100,000"
who performed the halftime show at super bowl 51,Lady Gaga
who was elected president of the united states in 1928,Herbert Hoover
who wrote the theme song to law and order,Mike Post
who plays lois's dad on family guy,MacFarlane
who plays david in alvin and the chipmunks,Jason Lee
where is the tennessee titans football stadium located,"Nashville, Tennessee"
who is directly elected according to the constitution,senators
where is the suez canal located on a map,Egypt
when did the romanticism period start and end,1780–1830
three act puccini opera first performed in 1900,Tosca
which is the largest great lake in north america,Lake Superior
who wrote the song what child is this,William Chatterton Dix
who is credited with creating the gothic art movement,Abbot Suger
when did they stop using aluminum wiring in ontario,mid-1970s
when does the next apollo book come out,"May 1, 2018"
who created the borders of africa's countries,European imperial powers
where did the british empire control an entire continent,Australia
who won best boy band i heart radio music awards,BTS
when did it become law to stand for the national anthem,"June 22, 1942"
who wrote the song the glory of love,Billy Hill
who spoke the words ich bin ein berliner,U.S. President John F. Kennedy
who sang the american national anthem at the super bowl,Pink
capital of georgia the former soviet republic 7 letters,Tbilisi
who owns the four seasons hotel in las vegas,MGM Resorts International
form from material that has accumulated on the earths surface,Sedimentary rock
the sport psychology sub-field of performance enhancement deals primarily with,Arousal regulation
when do luke and lorelai get back together,Say Goodbye to Daisy Miller
who is mowgli's main enemy in the jungle book,Shere Khan
who drives the number 95 car in nascar,Michael Christopher McDowell
who sings the wire season 5 theme song,Steve Earle
who plays dorian tyrell when he puts on the mask,Peter Greene
who wrote the song to make you feel my love,Bob Dylan
who plays harry's mom in harry potter,Geraldine Margaret Agnew-Somerville
who won the men's ice skating 2018,Yuzuru Hanyu
when did they stop putting lead in paint,1992
who has won the cma entertainer of the year the most,Garth Brooks
who won season 2 of great british baking show,Joanne Wheatley
who played cory's older brother on boy meets world,Will Friedle
who has the most receiving yards in the nfl history,Jerry Rice
where are red blood cells made in adults,in the bone marrow
who is playing halftime show super bowl 2018,Justin Timberlake
when was the last time unc did not make the ncaa tournament,2003
where does the name de la rosa come from,Spanish
what does sip stand for in the ngn / ims context,Session Initiation Protocol
who makes the important government decisions in an autocracy,one person
who played the princess in kingsman secret service,Hanna Alström
who was the editor of the journal jugantor published in the time of swadeshi movement,Bhupendranath Dutt
who sang the theme song for the man with the golden gun,Lulu
where are the hormones of the anterior pituitary created,The pars distalis
the very last episode of that's so raven,Where There's Smoke
how many stores does lowes have in canada,62
who does brant daugherty play in pretty little liars,Noel Kahn
when did the new day win the tag team titles,2016
who is young george bailey in it's a wonderful life,Robert James Anderson
when will the flash season 4 be released,"October 10, 2017"
new movie of ajay devgan and sonakshi sinha,Action Jackson
tallest building in the world of all time,Burj Khalifa
who played mrs. trumbull on i love lucy,Mary Elizabeth Patterson
who was the successful commanding general of the northern forces in the civil war,George B. McClellan
the xix of the social security act of 1965 established,Medicaid
how many times have real madrid won the european cup.in paris,twelve
what was the purpose of the mall of america,shopping
what is small business tax rate in canada,10.5%
who is the present president of assam sahitya sabha,Dhrubajyoti Bora
love is not love that alters when it alteration finds meaning,Sonnet 116
most runs ever scored in a mlb inning,18
where is south pole located on a map,on the continent of Antarctica
who is considered to be the greatest english composer of the baroque period,Henry Purcell
when did the tradition of self government began in america,1783
what is the meaning of shalom in english,peace
which country has the smallest population in europe,Vatican City
who has the biggest airport in the us,Atlanta
who does the voice of mrs. wolowitz on the big bang theory,Carol Ann Susi
where does the saying get out of dodge come from,the drama series Gunsmoke
when will notre dame played michigan state again,2026
who has the most gold gloves at shortstop,Ozzie Smith
who plays the robot maid in richie rich,Brooke Wexler
university of michigan school of public health ranking,#4
when was the immigration act passed in canada,1923
who is the guy on keeping up with the kardashians,Jonathan Cheban
when was catch me if you can made,2002
who used the word physiology for the first time,Jean Fernel
how many dominoes do you need for mexican train,A double-twelve set
what is the filename extension used for all java source files,.java
when was the taj mahal built and completed,1632–53
who is the premier of northern cape 2018,Sylvia Lucas
when was the last time ny rangers won stanley cup,1993–94
when is the last time the new york giants won the super bowl,(2011
who has scored the most half centuries in test cricket,Sachin Tendulkar
who had the longest tenure as moderator on meet the press,Tim Russert
who sings it's my party and i cry if i want to,Lesley Gore
what is the minimum size of a udp datagram,8 bytes
billy ocean when the going gets tough movie,The Jewel of the Nile
when did united states enter world war i,April 1917
who sold out jesus for 30 pieces of silver,Judas Iscariot
who plays jimmy's mom in 8 mile,Kim Basinger
who plays the dad in malcom in the middle,Bryan Cranston
who won the ladies ice skating in the olympics,Alina Zagitova
the length and direction of a straight line between two locations or positions,displacement
converting stereo signal to mono signal is called,Panning
what is the system of government in japan,constitutional monarchy
where is union station in washington dc located,50 Massachusetts Avenue NE
who sings song at the end of beauty and the beast,Josh Groban
super robot monkey team hyperforce go fighting games,Galactic Smash
where did they film the show the crossing,"British Columbia, Canada"
who wrote lord have mercy on the working man,Kostas
in which year was led zepplin refused entry into singapore because the band members had long hair,1972
where does the term pop music come from,Britain
who discovered gold in the sierra nevada of california,James W. Marshall
when was the last time the crows were in the grand final,2017
who plays scrooge mcduck in the new ducktales,David Tennant
state the process that divides one nucleus into two genetically identical nuclei,mitosis
who did kenny rogers sing mary did you know with,Wynonna Judd
which layer of the osi model handles physical addressing,physical layer or layer 1
jawaharlal nehru centre for advanced scientific research jakkur campus,"Jakkur, Bangalore, India"
known as the punk poet who used poetry in their music,John Cooper Clarke
who sang last night on saturday night live,Childish Gambino
who has scored the most points for wales v france,Neil Jenkins
who sings oh what a night late december back in 63,the Four Seasons
puella magi madoka magica when does madoka become a magical girl,My Very Best Friend
ahana from dil sambhal ja zara real name,Smriti Kalra
when was the last year thanksgiving was on the 23rd,2017
what does the air gap do on a dishwasher,backflow prevention
who sings the theme song to all that,TLC
who is often associated with printing the first book using moveable type in germany,Johannes Gutenberg
which is the world's largest company in terms of revenue,Walmart
who was one of the first to chart the course of forgetting over time,Hermann Ebbinghaus
what is the job of the whip in congress,to ensure party discipline
who sang the original scooby doo theme song,Larry Marks
where do red ear slider turtles lay eggs,a hole
when is season 7 race to the edge coming out,"February 16, 2018"
who is darrell brother in the walking dead,Merle Dixon
which mirror is used in vehicles for rear view,rear-view mirror
who did cora marry in once upon a time,Henry
where did the crown of thorns starfish come from,Indo-Pacific
where is the world cup being held 2018,Russia
what features of muscle contraction can be determined from an emg (electromyogram),electric potential generated
what is the minimum dollar amount for federal court,"$75,000"
french film pioneer who introduced newsreel in 1910,Charles Pathé
the victim was asking for it is an example of a,Victim blaming
where does kevins family go in home alone 2,Florida
list all the planet of the ape movies,Planet of the Apes
who won entertainer of the year country music awards,Garth Brooks
when do mr schuester and emma get together,the fourth season
where is final four being held this year,the Alamodome
when was the last time arsenal win premier league,2003–04
who coined the phrase let them eat cake,Jean-Jacques Rousseau
when did russia join the world economic forum,1997
how can you remove the defect of vision presbyopia,Eye glasses
who sang i put a spell on you in hocus pocus,Bette Midler
who was executed for being an american spy during the revolutionary war,Nathan Hale
how many nuclear power plants in washington state,3
what time can you legally buy alcohol in michigan,7 a.m.
when does the 14th season of grey's anatomy come out,"September 28, 2017"
what is the shannara chronicles season 2 based on,The Sword of Shannara Trilogy
where does patience is a virtue come from,"""Psychomachia,"""
when are general elections held in the us,every two to six years
where was the louisiana purchase signed in 1803,Paris
who is the chief economic advisor of india,Arvind Subramanian
how do you spell padawan from star wars,Padawan
who is the minister of youth in namibia,Erastus Utoni
do you cut cards to the left or right,right
how did long john silver lose his leg in treasure island,in the Royal Navy
what is the spelling of lakh in english,lakh
what level is a city and guilds qualification,entry level to level 7
how many seasons has greys anatomy been on tv,14
who is the ceo of crate and barrel,Neela Montgomery
where did the tradition of the pinata come from,treats
who is the head a in pretty little liars,CeCe Drake
how many students does monarch high school have,"2,406"
what is the name of the dragon in eragon,Saphira
who has the most trophies in la liga,Real Madrid
when did we decide to leave the eu,23 June 2016
who issued ashwamedha coins after performing ashvamedha sacrifice,Samudragupta
in which regions are most of africa petroleum and natural gas found,Nigeria
when will miraculous ladybug season 2 episode 12 come out,30 March 2018
who does betty end up with on riverdale,Archie Andrews
what is money as a medium of exchange,fiat money
when was the cleveland browns last winning game,2016
factories that assemble parts made in other countries,special economic zones
the gulf stream the world's fastest ocean current flows along the western side of this water body,Atlantic ocean
when is the last time the jaguars won a playoff game,2017
what is the minimum number of parties required to enter into a deed,two parties
who played cruella de vil in 101 dalmatians,Glenn Close
what genre is the magic tree house books,Children's historical fantasy
where did students for a democratic society start,"Ann Arbor, Michigan"
who was the first black person to register to vote,Thomas Mundy Peterson
where does sex and the city take place,New York City
who explored waters of cuba the bahamas and hispaniola,Christopher Columbus
los angeles stadium at hollywood park opening date,2020
who played raquel in only fools and horses,Tessa Peake-Jones
who does the voice of the beast in the new movie,Dan Stevens
who is known as the super fast boy in the series the icredible,Dashiell Robert Parr / Dash
who was the first signatory of the israeli declaration of independence,David Ben-Gurion
where does arsenic and old lace take place,"Brooklyn, New York"
where can you find convergent boundaries on earth,Mariana Trench
when did fortnite save the world first come out,"July 25, 2017"
what kind of beast is the beast from beauty and the beast,a chimera
when did somewhere over the rainbow come out,1939
when was the chain first used for f1,1978
when was the death penalty reinstated in oregon,1984
who told the story of the prodigal son,Jesus Christ
one piece english dubbed episode 564 release date,"September 16, 2012"
who stepped out of the dithyrambic chorus to become the first actor,Thespis
what is the longest pier in the uk,Southend Pier
where is the tablet of the ten commandments,Ark of the Covenant
do you need a permit or license to own a gun in florida,No
where does cleavage of the peptide bond by chymotrypsin occur,digestive systems
when does the nba season end this year,"April 11, 2018"
malcom in the middle season 1 episode 3,Home Alone 4
when was the time the eagles won the superbowl,2017
who named all the animals in the world,Adam
who played caesar in planet of the apes war,Andy Serkis
who abandoned traditional harmony and created the twelve-tone system for composition,Arnold Schoenberg
where does the band imagine dragons come from,"Las Vegas, Nevada"
who wrote the country song i can only imagine,Bart Millard
where does the water come from to fill lake eyre,Warburton River
who won nfl football coach of the year,Sean McVay
who played the virgin in conan the destroyer,Olivia d'Abo
when did the black death end in england,December 1349
when boy meets girl waiting for a star to fall,1988
christmas though a christian holiday began as a celebration of,the winter solstice
who changed the role of the first lady,Dolley Madison
who was the declaration of independence written for,the Second Continental Congress
who played susanna in legends of the fall,Julia Ormond
who was the voice of templeton in charlotte's web,Paul Lynde
the actual name of the confederate force at gettysburg was,Confederate States Army
new anime from the creators of attack on titan,Vinland Saga
where was gunsmoke to the last man filmed,"Tucson, Arizona"
who represents the arizona 9th district in the house,Kyrsten Sinema
this type of nuclear decay effectively turns a proton into a neutron,beta decay
who drove the number 18 car in nascar,Kyle Busch
what is the first covenant in the old testament,the Noahic Covenant
where does aarp fall on the political spectrum,non-partisan
when did the united states acquired puerto rico,1898
who's the original singer of help me make it through the night,Kris Kristofferson
nodding your head no is an example of,a gesture
what kind of book is where's waldo,puzzle
when is beyblade burst super z coming out,"April 2, 2018"
who plays the bad guy in the good place,Ted Danson
most polluted city in the world according to world health organization,Zabol
